[
  {
    "title": "Change Tone to Slang",
    "prompt": "Act as a content writer and editor. Rewrite the text with the following\ninstructions:\n- Use slang tone of voice.\n- Correct spelling, grammar, and punctuation.\n- Keep meaning unchanged.\n- Only output sentence. Don't add any comments or quotation marks.\n- You must respond using the same language as the input provided.\n\nText: {selection}\n\nRewritten text:",
    "creativity": "medium",
    "icon": "stars",
    "model": "openai_gpt4"
  }
]