[
  {
    "title": "Add Relevant Emoji as Suffix",
    "prompt": "You are a social media manager. You need to add a relevant emoji as a suffix to a given sentence. The emoji should be relevant to the sentence and should be placed after the sentence. The output must be just the sentence with the emoji as a suffix.\n\nSentence: {selection}",
    "creativity": "medium",
    "icon": "stars",
    "model": "google-gemini-3-flash"
  }
]