[
  {
    "title": "Debate a Topic",
    "prompt": "Take a stance on the topic and {argument default=for} it. Construct a convincing argument and provide evidence to support your stance.\n\nTopic: {selection}\n\nArgument:",
    "creativity": "high",
    "icon": "stars",
    "model": "openai-gpt-4o"
  }
]