[
  {
    "title": "Fix Spelling and Grammar",
    "prompt": "Act as a spelling corrector and improver. Rewrite the text with corrected spelling, grammar and punctuation. Don't add any comments or quotation marks. You must respond using the same language as the input provided.\n\nText: {selection}\n\nRewritten text:",
    "creativity": "low",
    "icon": "stars",
    "model": "openai-gpt-4o"
  }
]