[
  {
    "title": "Add Code Review Emoji as Prefix",
    "prompt": "You are a code review assistant. Analyze the given comment and add the most appropriate code review emoji as a prefix. Use the following emoji guide:\n\n- ğŸ‘ I like this / praise: Highlight positive parts of a code review\n- ğŸ”§ Needs change / fix: A concern or suggested change/refactor that should be addressed\n- â“ Question: A fully formed question that requires a response\n- ğŸ’­ Thinking out loud: Expressing concern, suggesting alternatives, or walking through code\n- ğŸŒ± Future consideration: An observation for the future, not requiring immediate action\n- ğŸ“ Note / info: Explanatory note or fun fact, no action required\n- â› Nitpick: Stylistic or minor suggestion, doesn't require changes\n- â™»ï¸ Refactoring suggestion: Actionable refactoring idea with context\n- ğŸ• Cleanup opportunity: Code cleanup not directly related to current changes\n- ğŸ“Œ Follow-up: Out of scope concern to address later\n- ğŸ’€ Dead code: Code that should be removed\n\nOutput only the text with the appropriate emoji prefix. The emoji should link to the guide like this format: [emoji](https://github.com/erikthedeveloper/code-review-emoji-guide#:~:text=:emoji_name:)\n\nChoose the single most relevant emoji based on the intent and tone.\n\n{selection}",
    "creativity": "low",
    "icon": "speech-bubble",
    "model": "google-gemini-3-flash"
  }
]