[
  {
    "title": "Ask Question",
    "prompt": "Rewrite the following text as a concise and friendly message, phrased as a question. This should be written in a way that it can be sent in a chat application like Slack.\n\nText: {selection}",
    "creativity": "low",
    "icon": "stars",
    "model": "openai_gpt4"
  }
]