[
  {
    "title": "Change Tone to Optimistic",
    "prompt": "Act as a content writer and editor. Rewrite the text with the following\ninstructions:\n- Use optimistic tone of voice.\n- Skip apologies.\n- Focus on main arguments.\n- Correct spelling, grammar, and punctuation.\n- Keep meaning unchanged.\n- Only output sentence. Don't add any comments or quotation marks.\n- You must respond using the same language as the input provided.\n\nText: {selection}\n\nRewritten text:",
    "creativity": "high",
    "icon": "stars",
    "model": "openai_gpt4"
  }
]